evidence_id,character_name,novel_title,passage_text,passage_start,passage_end,context_window,evidence_type,causal_markers,emotional_markers,temporal_position,has_pronoun,has_direct_name,character_role,narrative_importance,backstory_relevance,passage_length
Noirtier_48263_48922_3428178390,Noirtier,The Count of Monte Cristo,"

“I called you because you were running like a madman, and I was afraid
you would throw yourself into the sea,” said Caderousse, laughing.
“Why, when a man has friends, they are not only to offer him a glass of
wine, but, moreover, to prevent his swallowing three or four pints of
water unnecessarily!”

Fernand gave a groan, which resembled a sob, and dropped his head into
his hands, his elbows leaning on the table.

“Well, Fernand, I must say,” said Caderousse, beginning the
conversation, with that brutality of the common people in which
curiosity destroys all diplomacy, “you look uncommonly like a rejected
lover;” and he burst into a hoarse laugh.

",48263,48922,659,negative,so|because,love|afraid,0.018235753305922208,True,False,mentioned,0.7000000000000001,1.0,659
Noirtier_49747_50050_404816065,Noirtier,The Count of Monte Cristo,"

“Poor Fernand has been dismissed,” continued Caderousse.

“Well, and what then?” said Fernand, lifting up his head, and looking
at Caderousse like a man who looks for someone on whom to vent his
anger; “Mercédès is not accountable to any person, is she? Is she not
free to love whomsoever she will?”

",49747,50050,303,negative,so|then,love|anger,0.018796469753428344,True,False,mentioned,0.65,0.35000000000000003,303
Noirtier_51009_51283_882213834,Noirtier,The Count of Monte Cristo,"

“Well, never mind,” answered Caderousse, pouring out a glass of wine
for Fernand, and filling his own for the eighth or ninth time, while
Danglars had merely sipped his. “Never mind—in the meantime he marries
Mercédès—the lovely Mercédès—at least he returns to do that.”

",51009,51283,274,negative,,love,0.0192733054385717,True,False,mentioned,0.25,0.45,274
Noirtier_53166_53851_2271229849,Noirtier,The Count of Monte Cristo,"

Fernand, probably excited beyond bearing, pricked by Danglars, as the
bull is by the bandilleros, was about to rush out; for he had risen
from his seat, and seemed to be collecting himself to dash headlong
upon his rival, when Mercédès, smiling and graceful, lifted up her
lovely head, and looked at them with her clear and bright eyes. At this
Fernand recollected her threat of dying if Edmond died, and dropped
again heavily on his seat. Danglars looked at the two men, one after
the other, the one brutalized by liquor, the other overwhelmed with
love.

“I shall get nothing from these fools,” he muttered; “and I am very
much afraid of being here between a drunkard and a coward.",53166,53851,685,internal,,love|afraid,0.020088309062069497,True,False,mentioned,0.35000000000000003,0.85,685
Noirtier_54821_55253_2957147066,Noirtier,The Count of Monte Cristo,"

Mercédès courtesied gravely, and said—“That is not my name, and in my
country it bodes ill fortune, they say, to call a young girl by the
name of her betrothed before he becomes her husband. So call me
Mercédès, if you please.”

“We must excuse our worthy neighbor, Caderousse,” said Dantès, “he is
so easily mistaken.”

“So, then, the wedding is to take place immediately, M. Dantès,” said
Danglars, bowing to the young couple.

",54821,55253,432,negative,so|then|owing to,,0.020713636367071284,True,False,mentioned,0.44999999999999996,0.30000000000000004,432
Noirtier_55600_55923_3715532972,Noirtier,The Count of Monte Cristo,"

“My wife’s brother is my brother,” said Edmond; “and we, Mercédès and
I, should be very sorry if he were absent at such a time.”

Fernand opened his mouth to reply, but his voice died on his lips, and
he could not utter a word.

“Today the preliminaries, tomorrow or next day the ceremony! You are in
a hurry, captain!”

",55600,55923,323,negative,so,,0.021007974717884813,True,False,mentioned,0.30000000000000004,0.5,323
Noirtier_56788_57347_1417580439,Noirtier,The Count of Monte Cristo,"

“Yes, yes, I understand,” said Danglars, and then in a low tone, he
added, “To Paris, no doubt to deliver the letter which the grand
marshal gave him. Ah, this letter gives me an idea—a capital idea! Ah;
Dantès, my friend, you are not yet registered number one on board the
good ship _Pharaon_;” then turning towards Edmond, who was walking
away, “A pleasant journey,” he cried.

“Thank you,” said Edmond with a friendly nod, and the two lovers
continued on their way, as calm and joyous as if they were the very
elect of heaven.



 Chapter 4. Conspiracy

",56788,57347,559,negative,then,love|joy,0.021456850148907244,True,False,mentioned,0.55,0.85,559
Noirtier_59204_59519_3092654207,Noirtier,The Count of Monte Cristo,"

“I—drunk!” said Caderousse; “well that’s a good one! I could drink four
more such bottles; they are no bigger than cologne flasks. Père
Pamphile, more wine!”

And Caderousse rattled his glass upon the table.

“You were saying, sir——” said Fernand, awaiting with great anxiety the
end of this interrupted remark.

",59204,59519,315,negative,,,0.022369714661828282,True,False,mentioned,0.15000000000000002,0.6,315
Noirtier_61100_61320_39967450,Noirtier,The Count of Monte Cristo,"

“What matters that?” muttered Fernand.

“And why, I should like to know,” persisted Caderousse, “should they
put Dantès in prison? he has neither robbed, nor killed, nor murdered.”

“Hold your tongue!” said Danglars.

",61100,61320,220,action,so,,0.023086101713359033,True,False,mentioned,0.2,0.5,220
Noirtier_64726_65087_3294119651,Noirtier,The Count of Monte Cristo,"

“Well!” resumed the Catalan, as he saw the final glimmer of
Caderousse’s reason vanishing before the last glass of wine.

“Well, then, I should say, for instance,” resumed Danglars, “that if
after a voyage such as Dantès has just made, in which he touched at the
Island of Elba, someone were to denounce him to the king’s procureur as
a Bonapartist agent——”

",64726,65087,361,action,so|then,,0.024456154165284398,True,False,mentioned,0.35,0.5,361
